{
  "classifications": [
    "native",
    "adapter",
    "refused",
    "not-promised"
  ],
  "generation": {
    "command": "python3 docs/_extras/generate_v1_capability_matrix.py --check",
    "deterministic": true,
    "input_digest": {
      "algorithm": "sha256",
      "files": [
        {
          "path": "CONTRIBUTING.md",
          "sha256": "1c3eb11006184cde0489386224ae42238d6acbf74556ffb9f3bbe9390a3622ff"
        },
        {
          "path": "bindings/python/src/n4m/_ffi_decls.py",
          "sha256": "b5920730302c51f25ea97d287194903d8d328958f9164f4a046db7f8f7462062"
        },
        {
          "path": "bindings/python/src/n4m/_impl/native.py",
          "sha256": "27c0868a6ea30217c61a89e2b92d1ebdf6728ddf18aa0d0f2c50d50028a15e8a"
        },
        {
          "path": "bindings/python/src/n4m/_impl/native_sweeps.py",
          "sha256": "a7215ef781330b6060e767c417e270b5be8b8f5b58bb244e6c3a13b9a3049f03"
        },
        {
          "path": "catalog/methods/aom_pop.aom_chain_fixed_fit.yaml",
          "sha256": "09cee2f210463fb4f93d9b4018796c6b632f5e2d922f3db56969fbc20ecc899e"
        },
        {
          "path": "catalog/methods/aom_pop.aom_chain_ridge_pls.yaml",
          "sha256": "f9b27de6bddf45c9ad7f4ad33e18dc5ec0c0a9e7333cef527dd728b6fc387408"
        },
        {
          "path": "catalog/methods/aom_pop.aom_chain_screen_refit.yaml",
          "sha256": "c8d4fa3cec6467745eb2e558c4aea67ce336492957dd0457effbfe1b22f98d95"
        },
        {
          "path": "catalog/methods/aom_pop.aom_chain_sweep.yaml",
          "sha256": "c3fcbfef00e53c4152144e367784e2714494039a64730708305fddae9f1af4e2"
        },
        {
          "path": "catalog/methods/aom_pop.aom_pls.yaml",
          "sha256": "faa658884e4b862cdf4ce5285817f3f4510afc2480e0b1c8600f64ee13037708"
        },
        {
          "path": "catalog/methods/aom_pop.aom_pls_superblock.yaml",
          "sha256": "2703aacaaa8c6755ecfbbf2b777e5c46176db3d9e7553d75008dbb3be3a4f344"
        },
        {
          "path": "catalog/methods/aom_pop.aom_preprocessing.yaml",
          "sha256": "c1751dc706ea4cb9784ec2dea41ac6058d081d6493ea50f9e6e2a8c21e9993b0"
        },
        {
          "path": "catalog/methods/aom_pop.aom_ridge_pls_superblock.yaml",
          "sha256": "e08e203a8ebb8091dd92fc86660b73e9038ad647c3c7fa978ff5fee2f04ee910"
        },
        {
          "path": "catalog/methods/aom_pop.aom_staged_chain_campaign.yaml",
          "sha256": "e4dc076aeb204f29954e4992ec1f9e0e1640522c74fd83009cfd07b4d2abca1e"
        },
        {
          "path": "catalog/methods/aom_pop.aom_sweep.yaml",
          "sha256": "b0ff1bc81a105ea0ff67dcc2e689862f6f634593d3cf0f258493f7b8f36db708"
        },
        {
          "path": "catalog/methods/aom_pop.operator_pls_stack.yaml",
          "sha256": "b7b5c4a48885ee5ccd921f1093e585f58af70a9e7fafc88d22bbacc50f6c6ad4"
        },
        {
          "path": "catalog/methods/aom_pop.pop_pls.yaml",
          "sha256": "6315e6ee8b81b72b6e482e277fe872436b64182d2ab5cb5ae78efc3f41dc1938"
        },
        {
          "path": "catalog/methods/aom_pop.ridge_active_superblock.yaml",
          "sha256": "3770153953017c1bed875b06990f26f3c91b58a540c5875378ce2187e0b16048"
        },
        {
          "path": "catalog/methods/aom_pop.ridge_blender.yaml",
          "sha256": "8003db6ec03896d99e017fa1168e3ceaf2641bb2e168ebdfb0d3fc352d9cdab0"
        },
        {
          "path": "catalog/methods/aom_pop.ridge_global.yaml",
          "sha256": "546779290ca8c8e29c2a8f584fe40a2b51a205fac23f3e9ff1f69d1feffe0599"
        },
        {
          "path": "catalog/methods/aom_pop.ridge_mkl_superblock.yaml",
          "sha256": "dadb23743c134b184192c40e3c5105200fd6503b9ee1e3912d2a517a528bf64d"
        },
        {
          "path": "catalog/methods/aom_pop.ridge_superblock.yaml",
          "sha256": "d46eeaa3f14a9a2795633821826f07f5ccacae605383e61225aa56dd1c85be16"
        },
        {
          "path": "catalog/methods/aom_pop.robust_hpo.yaml",
          "sha256": "54b61b9f91374590e576b569f1c941239b790b1cf4bfe085082fbb7f8a806000"
        },
        {
          "path": "catalog/methods/augmentation.drift.linear_drift.yaml",
          "sha256": "9135b8f10cb9a9cd6bb223071293e8e50cbdff448e6ba515dcb4f09878949391"
        },
        {
          "path": "catalog/methods/augmentation.drift.path_length.yaml",
          "sha256": "a98c8d01bebd549b192618ef3fd1cb6a3ac4fe5bf36d35190ea4b846d37af6e1"
        },
        {
          "path": "catalog/methods/augmentation.drift.poly_drift.yaml",
          "sha256": "138fa8c03c0dc46510d1e44298654a10cbfbe24a797e89f659462cbd9eccc341"
        },
        {
          "path": "catalog/methods/augmentation.edge_artifacts.detector_rolloff.yaml",
          "sha256": "ab2fb4d81a6dcd07e1bcd9895055c7119c212e3de9a235a4cae3a4aac0607355"
        },
        {
          "path": "catalog/methods/augmentation.edge_artifacts.edge_artifacts.yaml",
          "sha256": "07c1d98edd4de287439998168e4e7380b64f261514a5f49abc9ff8712ab9b592"
        },
        {
          "path": "catalog/methods/augmentation.edge_artifacts.edge_curvature.yaml",
          "sha256": "79810d1edb58baa3a529d5be6716aaebf06274195ad434c1419388d0e62fc34b"
        },
        {
          "path": "catalog/methods/augmentation.edge_artifacts.stray_light.yaml",
          "sha256": "9351e3270b3eb495f44cb54d4362d3fccaa387afa4c897868842f957f8c480d2"
        },
        {
          "path": "catalog/methods/augmentation.edge_artifacts.truncated_peak.yaml",
          "sha256": "68b27d851d60ee01d58f87b64bd3dc41d3ba68d57d17a57308a9c00decdbdef9"
        },
        {
          "path": "catalog/methods/augmentation.environmental.moisture.yaml",
          "sha256": "7b041038102de1aacddf416b7914406815e058f8a5bbbdab322e8585812a720d"
        },
        {
          "path": "catalog/methods/augmentation.environmental.temperature.yaml",
          "sha256": "eaedaa429c66328415a15bf3d74068922ca29c4f6efc1f5fd02134e7813f2a6e"
        },
        {
          "path": "catalog/methods/augmentation.mixup.local_mixup.yaml",
          "sha256": "bcd376952615f48e2cf07f9c9052a82abb7de1446d7287519c48d1a3d8e235c1"
        },
        {
          "path": "catalog/methods/augmentation.mixup.mixup.yaml",
          "sha256": "37be48a9c23f6c3de881496ddca9b97e7153538ab381672df3dfbdd22d29aa24"
        },
        {
          "path": "catalog/methods/augmentation.noise.gaussian_noise.yaml",
          "sha256": "30d853013df8f08c35dd41303ae233aad64fe94e487e2dcd0d859fb770b02184"
        },
        {
          "path": "catalog/methods/augmentation.noise.hetero_noise.yaml",
          "sha256": "e879e291d9afff2087909561c4310a9ab0cf67748546df577669a23b0c4a6e9b"
        },
        {
          "path": "catalog/methods/augmentation.noise.multiplicative_noise.yaml",
          "sha256": "7045e1509ed383310df49936e87d8489283eac4491bb14b545e9fa3a6dd59ac8"
        },
        {
          "path": "catalog/methods/augmentation.noise.spike_noise.yaml",
          "sha256": "0dfd2712cb4b24b822ba490068bb6c40eda72354c137a9f4fb856ded7a796665"
        },
        {
          "path": "catalog/methods/augmentation.random.random_x_op.yaml",
          "sha256": "f9ff07390b024065c418b392aef44b150c761027fcf25fc1b1288917c511ffc3"
        },
        {
          "path": "catalog/methods/augmentation.random.rotate_translate.yaml",
          "sha256": "adf12f0ac1129cf5d870a9499aca48505043a10c7ce7b4c5f124c9efdd90a92b"
        },
        {
          "path": "catalog/methods/augmentation.scattering.batch_effect.yaml",
          "sha256": "e1d0f243621518951b5ea90435ae59e0f15b379279dea2a99297b34f57f9e975"
        },
        {
          "path": "catalog/methods/augmentation.scattering.dead_band.yaml",
          "sha256": "6957c95a01b7cda7b6ff638ea10d797544cea8dcda3df25ac8bdd1014b96ef53"
        },
        {
          "path": "catalog/methods/augmentation.scattering.emsc_distort.yaml",
          "sha256": "8ee0541feeefe8bcbc9eaae5ff090fafe42249b5b26ec322191887bf22f06649"
        },
        {
          "path": "catalog/methods/augmentation.scattering.instrument_broaden.yaml",
          "sha256": "ac1481a4b6625a26475f3ea96452385bd0a387f29aefd4c72efef61a30549adc"
        },
        {
          "path": "catalog/methods/augmentation.scattering.particle_size.yaml",
          "sha256": "8a4e224414b2e92fb95a3bd9cee6c5a84deca4d89ef507f374e6aa7044f67a1a"
        },
        {
          "path": "catalog/methods/augmentation.scattering.scatter_sim_msc.yaml",
          "sha256": "df2522e3ddc174856c1ef18c9d121d3cb9ac8d3229773509cb1334ee29bf9e60"
        },
        {
          "path": "catalog/methods/augmentation.spectral.band_mask.yaml",
          "sha256": "22f1d1439bebb582814042091c2db32d684a856e14029a125a3c09a892322922"
        },
        {
          "path": "catalog/methods/augmentation.spectral.band_perturb.yaml",
          "sha256": "91ed5b318ff5dccc77e59be08d696c24411d6ac9c99217de521d8a120d5d3677"
        },
        {
          "path": "catalog/methods/augmentation.spectral.channel_dropout.yaml",
          "sha256": "7f5dc44df2933f0564cf79897c49defb5f9aad8300afe56daed2bd40226a2de7"
        },
        {
          "path": "catalog/methods/augmentation.spectral.gauss_jitter.yaml",
          "sha256": "8b3d47b9ef972e5165b6884fa15f0218777d67fda6afdb4ce48a64bd825074eb"
        },
        {
          "path": "catalog/methods/augmentation.spectral.local_clip.yaml",
          "sha256": "94e88148c74554fba69459f394a745bc049bee1701f8102cd9d3a82fbf794340"
        },
        {
          "path": "catalog/methods/augmentation.spectral.magnitude_warp.yaml",
          "sha256": "c1c8350f4d7ad8cc163d7f4c2b4ec27fdfbf4d321252ce272f73b41cbd157b58"
        },
        {
          "path": "catalog/methods/augmentation.spectral.unsharp_mask.yaml",
          "sha256": "40bbb0cafda37946dd513e4920fbccef0ed030c993b61bd37a0a2dc1e69e2a21"
        },
        {
          "path": "catalog/methods/augmentation.splines.spline_curve_simplification.yaml",